quote,image,industry,profile link
"Every time we invest in a little company, it's a battle against the odds.",https://thumbor.forbes.com/thumbor/200x200/smart/filters:format(jpeg)/https%3A%2F%2Fspecials-images.forbesimg.com%2Fimageserve%2F624e03ce0e62ac687c1c1f55%2F416x416.jpg%3Fbackground%3D000000%26cropX1%3D0%26cropX2%3D1200%26cropY1%3D0%26cropY2%3D1200,Wales native Michael Moritz got his start as a journalist at Time Magazine after emigrating to America in 1976.,https://www.forbes.com/profile/michael-moritz/?list=billionaires
,https://thumbor.forbes.com/thumbor/200x200/smart/filters:format(jpeg)/https%3A%2F%2Fspecials-images.forbesimg.com%2Fimageserve%2F5e5fd53c44b78400068bfb15%2F416x416.jpg%3Fbackground%3D000000%26cropX1%3D23%26cropX2%3D2692%26cropY1%3D0%26cropY2%3D2667,"For decades Teh Hong Piow chaired Malaysian banking behemoth Public Bank, which he started in 1966.",https://www.forbes.com/profile/teh-hong-piow/?list=billionaires
,https://thumbor.forbes.com/thumbor/200x200/smart/filters:format(jpeg)/https%3A%2F%2Fspecials-images.forbesimg.com%2Fimageserve%2F5e5fd53c44b78400068bfb15%2F416x416.jpg%3Fbackground%3D000000%26cropX1%3D23%26cropX2%3D2692%26cropY1%3D0%26cropY2%3D2667,"For decades Teh Hong Piow chaired Malaysian banking behemoth Public Bank, which he started in 1966.",https://www.forbes.com/profile/teh-hong-piow/?list=billionaires
"The more well-off entrepreneurs that Brazil has, the better off the country will be. 
",https://thumbor.forbes.com/thumbor/200x200/smart/filters:format(jpeg)/https%3A%2F%2Fspecials-images.forbesimg.com%2Fimageserve%2F5c6cc7434bbe6f3a74231dba%2F416x416.jpg%3Fbackground%3D000000%26cropX1%3D238%26cropX2%3D3600%26cropY1%3D0%26cropY2%3D3360,Andre Esteves began his career as an intern at Brazilian investment bank Pactual and eventually acquired control of the bank. ,https://www.forbes.com/profile/andre-esteves/?list=billionaires
,https://thumbor.forbes.com/thumbor/200x200/smart/filters:format(jpeg)/https%3A%2F%2Fspecials-images.forbesimg.com%2Fimageserve%2F5d8ab5026de3150009a50431%2F416x416.jpg%3Fbackground%3D000000%26cropX1%3D743%26cropX2%3D3412%26cropY1%3D0%26cropY2%3D2667,Josh Harris cofounded alternative investment firm Apollo Global Management in 1990 with fellow billionaires Leon Black and Marc Rowan.,https://www.forbes.com/profile/joshua-harris/?list=billionaires
,https://thumbor.forbes.com/thumbor/200x200/smart/filters:format(jpeg)/https%3A%2F%2Fspecials-images.forbesimg.com%2Fimageserve%2F5bad50cea7ea4342a948e250%2F416x416.jpg%3Fbackground%3D000000%26cropX1%3D1355%26cropX2%3D3450%26cropY1%3D105%26cropY2%3D2198,"Investor with a Midas touch, Rakesh Jhunjhunwala is often referred to as India's Warren Buffett. ",https://www.forbes.com/profile/rakesh-jhunjhunwala/?list=billionaires
"Bernard Baruch said ""I got rich by selling soon."" I got rich by never selling.",https://thumbor.forbes.com/thumbor/200x200/smart/filters:format(jpeg)/https%3A%2F%2Fspecials-images.forbesimg.com%2Fimageserve%2F5f497ada09427da3f7707f50%2F416x416.jpg%3Fbackground%3D000000%26cropX1%3D1020%26cropX2%3D2530%26cropY1%3D718%26cropY2%3D2227,"In 1978, Ken Langone made an early investment in Home Depot and became a cofounder with Arthur Blank and Bernard Marcus, now billionaires. ",https://www.forbes.com/profile/ken-langone/?list=billionaires
"I did not want to brood on the past, but to look ahead, to secure the family heritage.",https://thumbor.forbes.com/thumbor/200x200/smart/filters:format(jpeg)/https%3A%2F%2Fspecials-images.forbesimg.com%2Fimageserve%2F58a1dd824bbe6f0e5586a942%2F416x416.jpg%3Fbackground%3D000000%26cropX1%3D0%26cropX2%3D744%26cropY1%3D256%26cropY2%3D1000,Most of Ludwig Merckle's wealth is from HeidelbergCement; he owns 27% after having sold nearly half the company following the 2008 financial crisis.,https://www.forbes.com/profile/ludwig-merckle/?list=billionaires
,https://thumbor.forbes.com/thumbor/200x200/smart/filters:format(jpeg)/https%3A%2F%2Fspecials-images.forbesimg.com%2Fimageserve%2Fcf7804ae82275751814f94dc5378387a%2F416x416.jpg%3Fbackground%3D000000%26cropX1%3D31%26cropX2%3D648%26cropY1%3D15%26cropY2%3D632,"Sandra Ortega Mera is the daughter of Amancio Ortega, cofounder of clothing giant Inditex, known for its Zara retail chain. ",https://www.forbes.com/profile/sandra-ortega-mera/?list=billionaires
,https://thumbor.forbes.com/thumbor/200x200/smart/filters:format(jpeg)/https%3A%2F%2Fspecials-images.forbesimg.com%2Fimageserve%2F5d8a9e3022254b0008e16181%2F416x416.jpg%3Fbackground%3D000000%26cropX1%3D0%26cropX2%3D3110%26cropY1%3D24%26cropY2%3D3132,Terry Pegula made a fortune in oil and gas and has since turned it into a sports empire that includes the Buffalo Bills and Buffalo Sabres.,https://www.forbes.com/profile/terrence-pegula/?list=billionaires
,https://thumbor.forbes.com/thumbor/200x200/smart/filters:format(jpeg)/https%3A%2F%2Fspecials-images.forbesimg.com%2Fimageserve%2F83fbe5433dfa59f56151a75692d7107d%2F416x416.jpg%3Fbackground%3D000000%26cropX1%3D0%26cropX2%3D744%26cropY1%3D24%26cropY2%3D768,"Karen Pritzker is one of 11 billionaire Pritzker heirs. Her grandfather, A.N. Pritzker, built industrial conglomerate Marmon and Hyatt hotels.",https://www.forbes.com/profile/karen-pritzker/?list=billionaires
,https://thumbor.forbes.com/thumbor/200x200/smart/filters:format(jpeg)/https%3A%2F%2Fspecials-images.forbesimg.com%2Fimageserve%2F5d8ab76522254b0008e162bb%2F416x416.jpg%3Fbackground%3D000000%26cropX1%3D377%26cropX2%3D1461%26cropY1%3D0%26cropY2%3D1085,Mitchell Rales and his brother Steven acquired a real estate investment trust in 1983 and merged it into the firm Danaher. ,https://www.forbes.com/profile/mitchell-rales/?list=billionaires
,https://thumbor.forbes.com/thumbor/200x200/smart/filters:format(jpeg)/https%3A%2F%2Fi.forbesimg.com%2Fmedia%2Flists%2Fpeople%2Fno-pic_416x416.jpg,Wolfgang Reimann and three of his siblings and three of his siblings own 95% of Luxembourg-based investment firm JAB Holding Company s.à r.l (JAB).,https://www.forbes.com/profile/wolfgang-reimann/?list=billionaires
,https://thumbor.forbes.com/thumbor/200x200/smart/filters:format(jpeg)/https%3A%2F%2Fi.forbesimg.com%2Fmedia%2Flists%2Fpeople%2Fno-pic_416x416.jpg,Matthias Reimann-Andersen and three of his siblings own 95% of Luxembourg-based investment firm JAB Holding Company s.à r.l (JAB).,https://www.forbes.com/profile/matthias-reimann-andersen/?list=billionaires
,https://thumbor.forbes.com/thumbor/200x200/smart/filters:format(jpeg)/https%3A%2F%2Fi.forbesimg.com%2Fmedia%2Flists%2Fpeople%2Fno-pic_416x416.jpg,Stefan Reimann-Andersen and three of his siblings own 95% of Luxembourg-based investment firm JAB Holding Company s.à r.l (JAB).,https://www.forbes.com/profile/stefan-reimann-andersen/?list=billionaires
,https://thumbor.forbes.com/thumbor/200x200/smart/filters:format(jpeg)/https%3A%2F%2Fi.forbesimg.com%2Fmedia%2Flists%2Fpeople%2Fno-pic_416x416.jpg,Renate Reimann-Hass and three of her siblings own 95% of Luxembourg-based investment firm JAB Holding Company s.à r.l (JAB).,https://www.forbes.com/profile/renate-reimann-haas/?list=billionaires
,https://thumbor.forbes.com/thumbor/200x200/smart/filters:format(jpeg)/https%3A%2F%2Fspecials-images.forbesimg.com%2Fimageserve%2F6050f48ca1ab099ed6e290cc%2F416x416.jpg%3Fbackground%3D000000%26cropX1%3D0%26cropX2%3D800%26cropY1%3D0%26cropY2%3D800,"Ruan Liping chairs Shanghai Stock Exchange-listed power strip supplier Gongniu Group, which went public in February 2020.",https://www.forbes.com/profile/ruan-liping/?list=billionaires
,https://thumbor.forbes.com/thumbor/200x200/smart/filters:format(jpeg)/https%3A%2F%2Fi.forbesimg.com%2Fmedia%2Flists%2Fpeople%2Fno-pic_416x416.jpg,Ruan Xueping is the vice chairman of Shanghai Stock Exchange-listed power strip supplier Gongniu Group.,https://www.forbes.com/profile/ruan-xueping/?list=billionaires
,https://thumbor.forbes.com/thumbor/200x200/smart/filters:format(jpeg)/https%3A%2F%2Fspecials-images.forbesimg.com%2Fimageserve%2F5d8af04618444200084e7329%2F416x416.jpg%3Fbackground%3D000000%26cropX1%3D247%26cropX2%3D1846%26cropY1%3D21%26cropY2%3D1620,"Early Microsoft employee Charles Simonyi is the man behind some of the company's most successful software, including Word and Excel.",https://www.forbes.com/profile/charles-simonyi/?list=billionaires
,https://thumbor.forbes.com/thumbor/200x200/smart/filters:format(jpeg)/https%3A%2F%2Fspecials-images.forbesimg.com%2Fimageserve%2F5d8af04618444200084e7329%2F416x416.jpg%3Fbackground%3D000000%26cropX1%3D247%26cropX2%3D1846%26cropY1%3D21%26cropY2%3D1620,"Early Microsoft employee Charles Simonyi is the man behind some of the company's most successful software, including Word and Excel.",https://www.forbes.com/profile/charles-simonyi/?list=billionaires
,https://thumbor.forbes.com/thumbor/200x200/smart/filters:format(jpeg)/https%3A%2F%2Fspecials-images.forbesimg.com%2Fimageserve%2F5d8aed2e22254b0008e1664c%2F416x416.jpg%3Fbackground%3D000000%26cropX1%3D376%26cropX2%3D1062%26cropY1%3D77%26cropY2%3D764,David Steward is the founder and chairman of IT provider World Wide Technology.,https://www.forbes.com/profile/david-steward/?list=billionaires
,https://thumbor.forbes.com/thumbor/200x200/smart/filters:format(jpeg)/https%3A%2F%2Fspecials-images.forbesimg.com%2Fimageserve%2F589f486a4bbe6f0e55868b04%2F416x416.jpg%3Fbackground%3D000000%26cropX1%3D0%26cropX2%3D744%26cropY1%3D177%26cropY2%3D921,Real estate mogul Radovan Vitek got his start during Slovakia's voucher privatization in the 1990s.,https://www.forbes.com/profile/radovan-vitek/?list=billionaires
"If you start painting yourself into a corner, life starts shutting down. There is always hopefully a next.",https://thumbor.forbes.com/thumbor/200x200/smart/filters:format(jpeg)/https%3A%2F%2Fspecials-images.forbesimg.com%2Fimageserve%2F5d8aba3122254b0008e162f8%2F416x416.jpg%3Fbackground%3D000000%26cropX1%3D475%26cropX2%3D1465%26cropY1%3D22%26cropY2%3D1011,"Les Wexner founded L Brands, a global retail empire that included Victoria's Secret and Bath & Body Works, and served as CEO for more than 5 decades.",https://www.forbes.com/profile/les-wexner/?list=billionaires
"Contributing to the preservation of creation, so that our planet remains habitable, is my mission.",https://thumbor.forbes.com/thumbor/200x200/smart/filters:format(jpeg)/https%3A%2F%2Fspecials-images.forbesimg.com%2Fimageserve%2F58a1c43331358e1a35ab4071%2F416x416.jpg%3Fbackground%3D000000%26cropX1%3D0%26cropX2%3D742%26cropY1%3D21%26cropY2%3D764,"Aloys Wobben, who founded wind turbine firm Enercon in the 1980s, died in mid 2021 at age 69, reportedly after a long illness",https://www.forbes.com/profile/aloys-wobben/?list=billionaires
Never take yourself too seriously. Nobody laughs at me quicker than I do.,https://thumbor.forbes.com/thumbor/200x200/smart/filters:format(jpeg)/https%3A%2F%2Fspecials-images.forbesimg.com%2Fimageserve%2F5efcbaa10f34010007451ef7%2F416x416.jpg%3Fbackground%3D000000%26cropX1%3D149%26cropX2%3D1355%26cropY1%3D446%26cropY2%3D1652,"In 1968, Sam Zell started Equity Group Investments, which today invests in industries like energy, logistics and healthcare.",https://www.forbes.com/profile/sam-zell/?list=billionaires
,https://thumbor.forbes.com/thumbor/200x200/smart/filters:format(jpeg)/https%3A%2F%2Fspecials-images.forbesimg.com%2Fimageserve%2F5e77eb8e10380d0006fbc8c3%2F416x416.jpg%3Fbackground%3D000000%26cropX1%3D18%26cropX2%3D210%26cropY1%3D5%26cropY2%3D197,"Bamford and his family own JCB, a construction equipment manufacturer with $2.9 billion in revenues.",https://www.forbes.com/profile/anthony-bamford/?list=billionaires
,https://thumbor.forbes.com/thumbor/200x200/smart/filters:format(jpeg)/https%3A%2F%2Fspecials-images.forbesimg.com%2Fimageserve%2F250c3eea55c826ca89f092951d0882b3%2F416x416.jpg%3Fbackground%3D000000%26cropX1%3D55%26cropX2%3D680%26cropY1%3D256%26cropY2%3D881,"Rainer Blickle died in March 2021. Prior to his death, he and his brother Juergen presided over SEW-Eurodrive, a German auto parts manufacturer they inherited.",https://www.forbes.com/profile/rainer-blickle/?list=billionaires
,https://thumbor.forbes.com/thumbor/200x200/smart/filters:format(jpeg)/https%3A%2F%2Fspecials-images.forbesimg.com%2Fimageserve%2F5c726e2131358e35dd270216%2F416x416.jpg%3Fbackground%3D000000%26cropX1%3D159%26cropX2%3D978%26cropY1%3D59%26cropY2%3D878,"Clive Calder became a billionaire in 2002, when he sold his music company Zomba Group to German mass media corporation Bertlesmann for $2.7 billion.",https://www.forbes.com/profile/clive-calder/?list=billionaires
,https://thumbor.forbes.com/thumbor/200x200/smart/filters:format(jpeg)/https%3A%2F%2Fspecials-images.forbesimg.com%2Fimageserve%2Fb11e15397177ea074c2b0d30ddeb459f%2F416x416.jpg%3Fbackground%3D000000%26cropX1%3D3%26cropX2%3D744%26cropY1%3D76%26cropY2%3D817,"The bulk of Frits Goldschmeding's fortune comes from his 32% stake in staffing company Randstad Holding, with branches in 38 countries.",https://www.forbes.com/profile/frits-goldschmeding/?list=billionaires
,https://thumbor.forbes.com/thumbor/200x200/smart/filters:format(jpeg)/https%3A%2F%2Fspecials-images.forbesimg.com%2Fimageserve%2F5c70f35031358e35dd26eedf%2F416x416.jpg%3Fbackground%3D000000%26cropX1%3D311%26cropX2%3D1689%26cropY1%3D7%26cropY2%3D1384,Ananda Krishnan is a Harvard Business School grad and former oil trader.,https://www.forbes.com/profile/ananda-krishnan/?list=billionaires
,https://thumbor.forbes.com/thumbor/200x200/smart/filters:format(jpeg)/https%3A%2F%2Fspecials-images.forbesimg.com%2Fimageserve%2F5d8adbfe6de3150009a506b3%2F416x416.jpg%3Fbackground%3D000000%26cropX1%3D268%26cropX2%3D548%26cropY1%3D4%26cropY2%3D284,"Joe Mansueto started independent investment research firm Morningstar in 1984 with $80,000 in savings.",https://www.forbes.com/profile/joe-mansueto/?list=billionaires
,https://thumbor.forbes.com/thumbor/200x200/smart/filters:format(jpeg)/https%3A%2F%2Fspecials-images.forbesimg.com%2Fimageserve%2F5c715d574bbe6f79c54746f9%2F416x416.jpg%3Fbackground%3D000000%26cropX1%3D2485%26cropX2%3D4872%26cropY1%3D21%26cropY2%3D2407,"Odd Reitan is the sole owner of Reitangruppen, which is one of the largest chains of grocery stores in Norway.",https://www.forbes.com/profile/odd-reitan/?list=billionaires
,https://thumbor.forbes.com/thumbor/200x200/smart/filters:format(jpeg)/https%3A%2F%2Fspecials-images.forbesimg.com%2Fimageserve%2F5f036214a694dd0006422271%2F416x416.jpg%3Fbackground%3D000000%26cropX1%3D227%26cropX2%3D1655%26cropY1%3D30%26cropY2%3D1457,"Antony ""Tony"" Ressler cofounded private equity giant Apollo Global Management with brother-in-law and fellow billionaire Leon Black in 1990.",https://www.forbes.com/profile/antony-ressler/?list=billionaires
,https://thumbor.forbes.com/thumbor/200x200/smart/filters:format(jpeg)/https%3A%2F%2Fspecials-images.forbesimg.com%2Fimageserve%2F5f036214a694dd0006422271%2F416x416.jpg%3Fbackground%3D000000%26cropX1%3D227%26cropX2%3D1655%26cropY1%3D30%26cropY2%3D1457,"Antony ""Tony"" Ressler cofounded private equity giant Apollo Global Management with brother-in-law and fellow billionaire Leon Black in 1990.",https://www.forbes.com/profile/antony-ressler/?list=billionaires
,https://thumbor.forbes.com/thumbor/200x200/smart/filters:format(jpeg)/https%3A%2F%2Fspecials-images.forbesimg.com%2Fimageserve%2F5bcfb7584bbe6f78bda5a116%2F416x416.jpg%3Fbackground%3D000000%26cropX1%3D1225%26cropX2%3D2565%26cropY1%3D163%26cropY2%3D1502,Tse Ping is a member of the billionaire Dhanin clan from Thailand and the guiding hand behind Hong Kong-listed Sino Biopharmaceutical. ,https://www.forbes.com/profile/tse-ping/?list=billionaires
,https://thumbor.forbes.com/thumbor/200x200/smart/filters:format(jpeg)/https%3A%2F%2Fspecials-images.forbesimg.com%2Fimageserve%2F5d94fceb67dd830006a28926%2F416x416.jpg%3Fbackground%3D000000%26cropX1%3D126%26cropX2%3D1024%26cropY1%3D82%26cropY2%3D980,"Ken Xie is the cofounder and CEO of Fortinet, a cybersecurity firm that offers firewalls, cloud security and other services to businesses.",https://www.forbes.com/profile/ken-xie/?list=billionaires
,https://thumbor.forbes.com/thumbor/200x200/smart/filters:format(jpeg)/https%3A%2F%2Fspecials-images.forbesimg.com%2Fimageserve%2F615b17659c4ca3fd706b1a5d%2F416x416.jpg%3Fbackground%3D000000%26cropX1%3D0%26cropX2%3D1877%26cropY1%3D621%26cropY2%3D2499,Tilman Fertitta is the owner of the Houston Rockets. The NBA approved the $2.2 billion purchase by Fertitta in October 2017. ,https://www.forbes.com/profile/tilman-fertitta/?list=billionaires
,https://thumbor.forbes.com/thumbor/200x200/smart/filters:format(jpeg)/https%3A%2F%2Fspecials-images.forbesimg.com%2Fimageserve%2F5de19788ea103f000653b784%2F416x416.jpg%3Fbackground%3D000000%26cropX1%3D65%26cropX2%3D660%26cropY1%3D3%26cropY2%3D598,"Son of a rubber trader, Prajogo Pangestu got his start in the timber business in the late 1970s.",https://www.forbes.com/profile/prajogo-pangestu/?list=billionaires
,https://thumbor.forbes.com/thumbor/200x200/smart/filters:format(jpeg)/https%3A%2F%2Fspecials-images.forbesimg.com%2Fimageserve%2F5de19788ea103f000653b784%2F416x416.jpg%3Fbackground%3D000000%26cropX1%3D65%26cropX2%3D660%26cropY1%3D3%26cropY2%3D598,"Son of a rubber trader, Prajogo Pangestu got his start in the timber business in the late 1970s.",https://www.forbes.com/profile/prajogo-pangestu/?list=billionaires
"The way the world is going, people like to have engagement and entertainment. People want to connect with each other, to see each other.",https://thumbor.forbes.com/thumbor/200x200/smart/filters:format(jpeg)/https%3A%2F%2Fspecials-images.forbesimg.com%2Fimageserve%2F58a2357231358e1a35ab4fc2%2F416x416.jpg%3Fbackground%3D000000%26cropX1%3D81%26cropX2%3D566%26cropY1%3D77%26cropY2%3D562,Teddy Sagi founded gambling software developer Playtech in 1999 and built it into a $700 million (sales) firm that trades on London's stock exchange.,https://www.forbes.com/profile/teddy-sagi/?list=billionaires
,https://thumbor.forbes.com/thumbor/200x200/smart/filters:format(jpeg)/https%3A%2F%2Fspecials-images.forbesimg.com%2Fimageserve%2F5e77d3b6d8e1ae0007b736a4%2F416x416.jpg%3Fbackground%3D000000%26cropX1%3D1902%26cropX2%3D5027%26cropY1%3D82%26cropY2%3D3208,"Thomas Straumann owns a 17% stake in the world's largest manufacturer of dental implants, publicly held Straumann Holding. ",https://www.forbes.com/profile/thomas-straumann/?list=billionaires
,https://thumbor.forbes.com/thumbor/200x200/smart/filters:format(jpeg)/https%3A%2F%2Fspecials-images.forbesimg.com%2Fimageserve%2F56dbf33ff9a34972aa0637c95ea9c36b%2F416x416.jpg%3Fbackground%3D000000%26cropX1%3D0%26cropX2%3D744%26cropY1%3D85%26cropY2%3D829,"David Sun cofounded and helps run Kingston Technology, which makes storage and memory products, as COO from a cubicle on the sales floor.",https://www.forbes.com/profile/david-sun/?list=billionaires
,https://thumbor.forbes.com/thumbor/200x200/smart/filters:format(jpeg)/https%3A%2F%2Fspecials-images.forbesimg.com%2Fimageserve%2Fa8e97df48d0b22d58aa783577ec6c714%2F416x416.jpg%3Fbackground%3D000000%26cropX1%3D3%26cropX2%3D744%26cropY1%3D63%26cropY2%3D804,"Kingston Technology CEO John Tu runs the firm, which makes storage and memory products, from a cubicle on sales floor.",https://www.forbes.com/profile/john-tu/?list=billionaires
,https://thumbor.forbes.com/thumbor/200x200/smart/filters:format(jpeg)/https%3A%2F%2Fi.forbesimg.com%2Fmedia%2Flists%2Fpeople%2Fno-pic_416x416.jpg,"Erich Wesjohann is the chairman and namesake of Germany-based EW Group, the world's largest poultry breeding and genetics company.
",https://www.forbes.com/profile/erich-wesjohann/?list=billionaires
,https://thumbor.forbes.com/thumbor/200x200/smart/filters:format(jpeg)/https%3A%2F%2Fi.forbesimg.com%2Fmedia%2Flists%2Fpeople%2Fno-pic_416x416.jpg,"Xu chairs Guangzhou Tinci Materials Technology, a chemical supplier.",https://www.forbes.com/profile/xu-jinfu/?list=billionaires
,https://thumbor.forbes.com/thumbor/200x200/smart/filters:format(jpeg)/https%3A%2F%2Fspecials-images.forbesimg.com%2Fimageserve%2F6220f15823d360f397d92ee1%2F416x416.jpg%3Fbackground%3D000000%26cropX1%3D1317%26cropX2%3D2912%26cropY1%3D283%26cropY2%3D1877,"Alexander Abramov is chairman of steel company Evraz, which is also his biggest holding. ",https://www.forbes.com/profile/alexander-abramov/?list=billionaires
"Everybody in America came from some immigrant place, or else they're Native American. That's what made America great.",https://thumbor.forbes.com/thumbor/200x200/smart/filters:format(jpeg)/https%3A%2F%2Fspecials-images.forbesimg.com%2Fimageserve%2F5d8ad87818444200084e723e%2F416x416.jpg%3Fbackground%3D000000%26cropX1%3D0%26cropX2%3D768%26cropY1%3D58%26cropY2%3D826,"Real estate tycoon Neil Bluhm is the owner of marquee Chicago properties like 900 North Michigan and the Ritz Carlton.
",https://www.forbes.com/profile/neil-bluhm/?list=billionaires
What I take pride in is having profitable companies.,https://thumbor.forbes.com/thumbor/200x200/smart/filters:format(jpeg)/https%3A%2F%2Fspecials-images.forbesimg.com%2Fimageserve%2F5d8af98622254b0008e166c7%2F416x416.jpg%3Fbackground%3D000000%26cropX1%3D2722%26cropX2%3D4120%26cropY1%3D980%26cropY2%3D2377,"The little-known king of subprime car loans, Don Hankey presides over the $2.1 billion (sales) Hankey Group, a Los Angeles-based auto services empire.",https://www.forbes.com/profile/don-hankey/?list=billionaires
What I take pride in is having profitable companies.,https://thumbor.forbes.com/thumbor/200x200/smart/filters:format(jpeg)/https%3A%2F%2Fspecials-images.forbesimg.com%2Fimageserve%2F5d8af98622254b0008e166c7%2F416x416.jpg%3Fbackground%3D000000%26cropX1%3D2722%26cropX2%3D4120%26cropY1%3D980%26cropY2%3D2377,"The little-known king of subprime car loans, Don Hankey presides over the $2.1 billion (sales) Hankey Group, a Los Angeles-based auto services empire.",https://www.forbes.com/profile/don-hankey/?list=billionaires
,https://thumbor.forbes.com/thumbor/200x200/smart/filters:format(jpeg)/https%3A%2F%2Fspecials-images.forbesimg.com%2Fimageserve%2F5f4977a36096df14bbef84d4%2F416x416.jpg%3Fbackground%3D000000%26cropX1%3D781%26cropX2%3D1650%26cropY1%3D314%26cropY2%3D1183,"Jane Lauder, granddaughter of cosmetics legend Estée Lauder, is an executive vice president and chief data officer at Estée Lauder. ",https://www.forbes.com/profile/jane-lauder/?list=billionaires
,https://thumbor.forbes.com/thumbor/200x200/smart/filters:format(jpeg)/https%3A%2F%2Fi.forbesimg.com%2Fmedia%2Flists%2Fpeople%2Fno-pic_416x416.jpg,Gwendolyn Sontheim Meyer inherited an estimated 8% stake in food giant Cargill.,https://www.forbes.com/profile/gwendolyn-sontheim-meyer/?list=billionaires
,https://thumbor.forbes.com/thumbor/200x200/smart/filters:format(jpeg)/https%3A%2F%2Fspecials-images.forbesimg.com%2Fimageserve%2F58a0baa54bbe6f0e55869bfa%2F416x416.jpg%3Fbackground%3D000000%26cropX1%3D0%26cropX2%3D744%26cropY1%3D77%26cropY2%3D821,"A chartered accountant, John Reece joined chemicals conglomerate Ineos in 2000 as financial director, less than two years after its founding.",https://www.forbes.com/profile/john-reece/?list=billionaires
,https://thumbor.forbes.com/thumbor/200x200/smart/filters:format(jpeg)/https%3A%2F%2Fspecials-images.forbesimg.com%2Fimageserve%2F59b00d1da7ea434a34f36956%2F416x416.jpg%3Fbackground%3D000000%26cropX1%3D168%26cropX2%3D3712%26cropY1%3D634%26cropY2%3D4180,"Eric Smidt is CEO of $5 billion (sales) Harbor Freight Tools, a home improvement retailer that has over 1,200 stores in 48 states.",https://www.forbes.com/profile/eric-smidt/?list=billionaires
"For me, being rich means being responsible first and foremost. Money is hard to earn, but it is even harder to manage it correctly.",https://thumbor.forbes.com/thumbor/200x200/smart/filters:format(jpeg)/https%3A%2F%2Fspecials-images.forbesimg.com%2Fimageserve%2F62471db4daae70f1df2b15f6%2F416x416.jpg%3Fbackground%3D000000%26cropX1%3D537%26cropX2%3D2441%26cropY1%3D13%26cropY2%3D1917,"Viktor Vekselberg, a Ukrainian-born aluminum baron, made his first million selling scrap copper from worn-out cables. ",https://www.forbes.com/profile/viktor-vekselberg/?list=billionaires
"All of a sudden, one day you're the big guy in the industry. At first I didn't know if I liked being the big guy, because with this came a new responsibility.",https://thumbor.forbes.com/thumbor/200x200/smart/filters:format(jpeg)/https%3A%2F%2Fspecials-images.forbesimg.com%2Fimageserve%2F59de76b431358e542c039eea%2F416x416.jpg%3Fbackground%3D000000%26cropX1%3D116%26cropX2%3D1254%26cropY1%3D44%26cropY2%3D1181,"Ronald Wanek is the founder of America's largest home furniture manufacturer and retailer, Ashley Furniture.",https://www.forbes.com/profile/ronald-wanek/?list=billionaires
,https://thumbor.forbes.com/thumbor/200x200/smart/filters:format(jpeg)/https%3A%2F%2Fspecials-images.forbesimg.com%2Fimageserve%2F5e741d5a10380d0006bdab99%2F416x416.jpg%3Fbackground%3D000000%26cropX1%3D884%26cropX2%3D2726%26cropY1%3D44%26cropY2%3D1885,"Rene Benko is the founder of Signa Holding, which manages more than $12 billion in real estate assets and is one of Europe's largest real estate and retail firms.",https://www.forbes.com/profile/rene-benko/?list=billionaires
,https://thumbor.forbes.com/thumbor/200x200/smart/filters:format(jpeg)/https%3A%2F%2Fspecials-images.forbesimg.com%2Fimageserve%2F5b7570b5a32f0129b2a24f38d50637f6%2F416x416.jpg%3Fbackground%3D000000%26cropX1%3D65%26cropX2%3D345%26cropY1%3D0%26cropY2%3D280,"John Brown ran Stryker Corp., a medical device and software company, for 32 years before retiring as chairman in 2009. ",https://www.forbes.com/profile/john-brown/?list=billionaires
